{
  "schema_version": "query-menu-v1",
  "catalog_version": "1.31.0",
  "module_id": "query",
  "default_query": "latest_stories",
  "queries": [
    {
      "query_id": "latest_stories",
      "label": "Latest stories",
      "description": "View published Cuebook News Stories and sources for an asset.",
      "skill_refs": [
        "query-cuebook"
      ],
      "mcp_tools": [
        "search_assets",
        "list_asset_cues",
        "get_cues"
      ],
      "availability": "available"
    },
    {
      "query_id": "story_detail",
      "label": "Story details",
      "description": "Read a News Story's claims, sources, and timeline.",
      "skill_refs": [
        "query-cuebook"
      ],
      "mcp_tools": [
        "get_cues"
      ],
      "availability": "available"
    },
    {
      "query_id": "asset_narratives",
      "label": "Asset narratives",
      "description": "View Cuebook's asset narrative library separately from News Stories.",
      "skill_refs": [
        "query-cuebook"
      ],
      "mcp_tools": [
        "search_assets",
        "list_asset_cues"
      ],
      "availability": "available"
    },
    {
      "query_id": "market_state",
      "label": "Market state",
      "description": "View current price, market session, and snapshot time.",
      "skill_refs": [
        "query-cuebook"
      ],
      "mcp_tools": [
        "search_assets",
        "get_market_state"
      ],
      "availability": "available"
    },
    {
      "query_id": "market_evidence",
      "label": "News and evidence",
      "description": "Search news, company announcements, regulatory filings, and independent reporting.",
      "skill_refs": [
        "query-cuebook",
        "build-market-research-pack"
      ],
      "mcp_tools": [
        "search_news"
      ],
      "availability": "backend_required"
    },
    {
      "query_id": "fundamentals",
      "label": "Fundamentals and valuation",
      "description": "Compare financial metrics and valuations on a consistent basis.",
      "skill_refs": [
        "query-cuebook",
        "build-market-research-pack"
      ],
      "mcp_tools": [
        "list_filings"
      ],
      "availability": "backend_required"
    },
    {
      "query_id": "market_series",
      "label": "Price and volume",
      "description": "View OHLCV and relative-performance series with bar-finality status.",
      "skill_refs": [
        "query-cuebook"
      ],
      "mcp_tools": [
        "get_candles"
      ],
      "availability": "backend_required"
    },
    {
      "query_id": "derived_metrics",
      "label": "Indicators and triggers",
      "description": "Compute reproducible technical, relative-performance, and trigger metrics locally from finalized bars.",
      "skill_refs": [
        "query-cuebook",
        "compute-cuebook-market-indicators"
      ],
      "mcp_tools": [
        "get_candles"
      ],
      "availability": "backend_required"
    },
    {
      "query_id": "tradingview_inspect",
      "label": "Inspect a TradingView chart",
      "description": "Inspect the creator's current local chart or run one bounded network research check without changing the chart.",
      "skill_refs": [
        "query-cuebook"
      ],
      "mcp_tools": [],
      "availability": "optional_connector",
      "optional_connectors": [
        "tradingview_desktop",
        "tradingview_research"
      ]
    },
    {
      "query_id": "tradingview_capture",
      "label": "Focused TradingView chart",
      "description": "Capture the latest decision structure at high information density while preserving axes, attribution, and the creator's original viewport.",
      "skill_refs": [
        "query-cuebook"
      ],
      "mcp_tools": [],
      "availability": "optional_connector",
      "optional_connectors": [
        "tradingview_desktop"
      ]
    },
    {
      "query_id": "settlement_history",
      "label": "View settlement",
      "description": "View observations, formula branches, and settlement results for a frozen viewpoint.",
      "skill_refs": [
        "query-cuebook",
        "reconcile-market-content-history"
      ],
      "mcp_tools": [
        "list_settlements"
      ],
      "availability": "backend_required"
    },
    {
      "query_id": "published_frame",
      "label": "Published Frame",
      "description": "Read a release-pinned Frame, visual semantics, settlement state, child follow-ups, and discussion entry point.",
      "skill_refs": [
        "query-cuebook"
      ],
      "mcp_tools": [
        "get_frame",
        "list_child_frames"
      ],
      "availability": "backend_required"
    },
    {
      "query_id": "community_skill",
      "label": "Community Skill",
      "description": "Discover a reviewed community Skill or resolve the exact version frozen into a Frame handoff.",
      "skill_refs": [
        "query-cuebook"
      ],
      "mcp_tools": [
        "list_community_skills",
        "get_community_skill"
      ],
      "availability": "available"
    },
    {
      "query_id": "commentator_profile",
      "label": "Commentator research",
      "description": "Study the sourcing, reasoning, and expression patterns of a public financial account.",
      "skill_refs": [
        "query-cuebook",
        "distill-market-commentator-profile"
      ],
      "mcp_tools": [],
      "availability": "available"
    },
    {
      "query_id": "media_format",
      "label": "Media-format research",
      "description": "Study structural patterns across articles, communities, visual posts, and short videos.",
      "skill_refs": [
        "query-cuebook",
        "distill-market-media-format"
      ],
      "mcp_tools": [],
      "availability": "available"
    }
  ],
  "output_modes": [
    {
      "output_id": "answer",
      "label": "Concise answer"
    },
    {
      "output_id": "comparison",
      "label": "Comparison table"
    },
    {
      "output_id": "source_bundle",
      "label": "Source bundle"
    },
    {
      "output_id": "data_table",
      "label": "Data table"
    },
    {
      "output_id": "factual_chart",
      "label": "Factual chart"
    },
    {
      "output_id": "history_view",
      "label": "History view"
    },
    {
      "output_id": "tradingview_observation",
      "label": "TradingView observation"
    },
    {
      "output_id": "tradingview_focused_capture",
      "label": "Focused chart image"
    },
    {
      "output_id": "creation_handoff",
      "label": "Creation handoff"
    }
  ]
}
